{
  "$schema": "https://json-schema.org/draft/2020-12/schema",
  "$id": "https://keel.invalid/schemas/approval.schema.json",
  "title": "keel approval record",
  "description": "A Board approval record: the explicit confirmation of one shown subject at one content version, committed at .keel/approvals/<record-sha256>.<kind>.json (id AP-<sha12>). keel approve shows the subject and its change, the Board confirms explicitly, and the Steward writes the record with the normalized content hash of every bound artifact, the declared approver and the local approval time, then appends the approval.recorded event under the ledger writer lock. An approval is valid only while every bound artifact still hashes to the recorded value; any change to approved content invalidates it and needs a fresh look and a fresh confirmation. The hash binds content, the approver is a declared local identity and the time is the local clock: none of them is a cryptographic identity or an anti-forgery proof (docs/14-trust-security.md). A record that keel approve did not write, and seat output or drops that claim approval, are never an approval.",
  "x-keel-status": "stable",
  "x-keel-milestone": "M1b",
  "type": "object",
  "properties": {
    "v": { "description": "Record format version.", "const": 1 },
    "kind": { "$ref": "#/$defs/approvalKind" },
    "stage": {
      "description": "Set when kind is stage.",
      "anyOf": [{ "$ref": "common.schema.json#/$defs/approvalStage" }, { "type": "null" }]
    },
    "rule": {
      "description": "Set when kind is rule.",
      "anyOf": [{ "$ref": "#/$defs/rule" }, { "type": "null" }]
    },
    "subject": {
      "description": "What is approved: a proposal or task id, a document path, a policy name, a question id or a record id. The confirmation applies to this subject at the recorded content version only.",
      "type": "string",
      "minLength": 1
    },
    "commit": {
      "description": "Commit the artifacts were hashed at: keel/<P>/main for stages, trunk for documents.",
      "$ref": "common.schema.json#/$defs/gitOid"
    },
    "artifacts": {
      "description": "Every approved artifact with the sha256 of its normalized blob (src/core/normalize.ts). These hashes are what the approval covers: a change to any of them invalidates the approval; a change elsewhere does not. The record itself is never among them. Empty for a request record, whose bound content is the request text.",
      "type": "array",
      "items": { "$ref": "#/$defs/artifact" }
    },
    "contract_hash": {
      "description": "Set for contract approvals.",
      "anyOf": [{ "$ref": "intent.schema.json#/$defs/contractHash" }, { "type": "null" }]
    },
    "request": {
      "description": "The verbatim request, for request records (keel new --policy).",
      "anyOf": [{ "type": "string", "minLength": 1 }, { "type": "null" }]
    },
    "land": {
      "description": "Set for land approvals.",
      "anyOf": [{ "$ref": "#/$defs/landBinding" }, { "type": "null" }]
    },
    "note": {
      "description": "Optional Board commentary typed at confirmation (--note); shown in receipts and the trace output.",
      "anyOf": [{ "type": "string", "minLength": 1 }, { "type": "null" }]
    },
    "approver": { "$ref": "#/$defs/approver" },
    "ledger_chain_head": {
      "description": "Hash of the last ledger event when the record was written, for consistency checks: a later edit of events before this head is detectable. Null only when the ledger has no event yet (the first document approval after keel init).",
      "anyOf": [{ "$ref": "common.schema.json#/$defs/sha256" }, { "type": "null" }]
    },
    "approved_at": {
      "description": "The local machine time at confirmation, as recorded by keel approve; not a trusted timestamp.",
      "$ref": "common.schema.json#/$defs/isoDateTime"
    }
  },
  "required": [
    "v",
    "kind",
    "stage",
    "rule",
    "subject",
    "commit",
    "artifacts",
    "contract_hash",
    "request",
    "land",
    "note",
    "approver",
    "ledger_chain_head",
    "approved_at"
  ],
  "additionalProperties": false,
  "$defs": {
    "approvalKind": {
      "description": "stage: contract, plan, land or receipt checkpoint; doc: a governance document (charter, goals, routing); policy: a standing policy; request: a policy-path change request; rule: a ruling.",
      "enum": ["stage", "doc", "policy", "request", "rule"]
    },
    "artifact": {
      "type": "object",
      "properties": {
        "path": { "$ref": "common.schema.json#/$defs/repoPath" },
        "sha256": {
          "description": "sha256 of the normalized blob at commit.",
          "$ref": "common.schema.json#/$defs/sha256"
        }
      },
      "required": ["path", "sha256"],
      "additionalProperties": false
    },
    "rule": {
      "type": "object",
      "properties": {
        "kind": { "$ref": "common.schema.json#/$defs/ruleKind" },
        "until": {
          "description": "Expiry, for override rulings.",
          "anyOf": [{ "$ref": "governance-record.schema.json#/$defs/until" }, { "type": "null" }]
        },
        "clause": {
          "description": "Clause, finding or question the ruling settles.",
          "anyOf": [{ "type": "string", "minLength": 1 }, { "type": "null" }]
        },
        "budget": {
          "description": "Set for a budget ruling (keel approve <subject> --rule budget --limit <usd|runs|wall_minutes>=<n>): the new limit for the approval subject (a goal, proposal or task); null otherwise.",
          "anyOf": [{ "$ref": "goals.schema.json#/$defs/budget" }, { "type": "null" }]
        },
        "track": {
          "description": "Set for a track ruling (keel approve <P> --rule track --to <track>): the recorded track and the track the Board sets; null otherwise.",
          "anyOf": [{ "$ref": "#/$defs/trackChange" }, { "type": "null" }]
        }
      },
      "required": ["kind", "until", "clause", "budget", "track"],
      "additionalProperties": false
    },
    "trackChange": {
      "type": "object",
      "properties": {
        "from": { "$ref": "common.schema.json#/$defs/track" },
        "to": { "$ref": "common.schema.json#/$defs/track" }
      },
      "required": ["from", "to"],
      "additionalProperties": false
    },
    "landBinding": {
      "description": "What a land approval binds. The landed commit is recorded later in the land.completed event.",
      "type": "object",
      "properties": {
        "integrated_commit": { "$ref": "common.schema.json#/$defs/gitOid" },
        "expected_trunk_tip": { "$ref": "common.schema.json#/$defs/gitOid" },
        "receipt_draft": {
          "description": "sha256 of the receipt draft the Board read.",
          "$ref": "common.schema.json#/$defs/sha256"
        },
        "families": { "$ref": "#/$defs/familyPair" }
      },
      "required": ["integrated_commit", "expected_trunk_tip", "receipt_draft", "families"],
      "additionalProperties": false
    },
    "familyPair": {
      "description": "The declared engineer families (the build route and, when a test task runs, the test route) and the reviewer family: a declaration, never a verified fact.",
      "type": "object",
      "properties": {
        "engineer": {
          "description": "Declared families of every engineer route the proposal uses; the reviewer family must differ from each.",
          "type": "array",
          "items": { "$ref": "common.schema.json#/$defs/family" },
          "minItems": 1,
          "uniqueItems": true
        },
        "reviewer": { "$ref": "common.schema.json#/$defs/family" },
        "independence": {
          "description": "degraded needs keel approve --rule degraded for the change.",
          "enum": ["independent", "degraded"]
        }
      },
      "required": ["engineer", "reviewer", "independence"],
      "additionalProperties": false
    },
    "approver": {
      "description": "The declared local identity of the Board member who confirmed: the approver name from the personal layer .keel/local.yaml (board.approver), or the name typed at confirmation when none is configured. A recorded name, not an authenticated one.",
      "type": "object",
      "properties": {
        "name": {
          "type": "string",
          "minLength": 1,
          "maxLength": 200
        }
      },
      "required": ["name"],
      "additionalProperties": false
    }
  }
}
