{
  "v": 1,
  "kind": "stage",
  "stage": "contract",
  "rule": null,
  "subject": "P-7F3K9Q",
  "commit": "9039efbbec515d639b0c38dd6fa1051cfc3b3d76",
  "artifacts": [
    {
      "path": ".keel/proposals/P-7F3K9Q-note-tags/intent.md",
      "sha256": "0d56ca86699535db5b9f4cd7cfe0c1ffc29801d7afbee585fb4e27402f6d5e64"
    },
    {
      "path": ".keel/proposals/P-7F3K9Q-note-tags/spec.delta.yaml",
      "sha256": "acf11480f415a69b1324358ede308ccf2eef18f4a9838fb59492b5c09ee3f257"
    }
  ],
  "contract_hash": "e90e8774ddb2fd72a1ba81b6149dd88cf5a721460a1ab3b0afd09be0cde09bea",
  "request": null,
  "land": null,
  "note": "Approved as framed; tags stay local to a note.",
  "approver": {
    "name": "board-owner"
  },
  "ledger_chain_head": "a20ce2e75c819179d0e749a61c62a14d6f0412afdac6d8c5c53d241d9a70d97e",
  "approved_at": "2026-09-21T14:30:00Z"
}
